Title,Body,Url,Category
Arasabira ubuvugizi abana bafite ubumuga bagihishwa n’imiryango yabo,"Gilbert Kubwimana uyobora Love with Actions, avuga ko yashinze uyu muryango agamije gufasha no gukorera ubuvugizi abana bafite ubumuga, kugira ngo babashe kuvuzwa, kwigishwa, kubona ibibatunga no gufasha imiryango yabo kwiyubaka.
Avuga ko ubu afite abana 40 kandi benshi muri bo ngo yasanze imiryango yabo ibakingirana ikabashyira mu kato.
Kubwimana agira ati ""Uko guhishwa igihe kirekire bishobora kuviramo bamwe urupfu kuko nko muri 2018 twapfushije abana bane, akato ni bimwe mu bibatera impfu"".
Umuryango Love With Actions (LWA) wahisemo gutumira inzego zitandukanye zikorera mu Murenge wa Bumbogo mu mahugurwa y’iminsi itatu ngo baganire ku burenganzira bw’abafite ubumuga hagamijwe kubakorera ubuvugizi.
Kubwimana akomeza agira ati ""Birasaba ubufatanye n’inzego zitandukanye kugira ngo abantu bahindure imyumvire mu gufasha aba bana bafite ubumuga"".
Umubyeyi witwa Faida Beatrice ufite abana babiri bafite ubumuga bw’ingingo, avuga ko kutagira ipfunwe no kubashyira ahagaragara byatumye Leta n’abafatanyabikorwa barimo LWA bamufasha kubavuza no kubashyira mu ishuri.
Faida agira ati ""Njye ntabwo nigeze mbahisha, narabahekaga nkajya gusenga, nkaba nsaba ababyeyi b’abana bafite ubumuga kubashyira ahagaragara Leta ikabafasha"".


Umushumba mu Itorero ry’Abangilikani, Pasiteri Kwiringirimana Emmanuel avuga ko umuntu uhisha umwana umugaye byazamubuza kujya mu ijuru kubera kwikunda n’ubwibone.
Ati ""Nyuma y’aya mahugurwa twahawe na Love With Actions tugiye kwigisha cyane abo tuyobora bahindure imyumvire, bareke kumva ko kugira ubumuga ari umuvumo cyangwa igihano gituruka ku Mana""
Umwalimu muri Kaminuza y’u Rwanda ishami ry’uburezi, Dr Sagahutu Jean Baptiste avuga ko kuba abafite ubumuga badashyirwa ahagaragara hahurira abantu benshi kandi muri ibyo bice bahari, ngo ari ikimenyetso cy’uko bahabwa akato gakomeye.
Atanga ingero z’ahantu hahurira abantu benshi nko mu muganda, mu rusengero, ahabera imikino n’imyidagaduro, avuga ko atari kenshi wahasanga abafite ubumuga!
Umuryango Love with Actions uvuga ko hirya no hino mu gihugu hari abana benshi bagikingiranwa mu nzu kubera ko bafite ubumuga, ugasaba uruhare rwa buri wese guhindura imyumvire no gukorera aba bana ubuvugizi.
Umunyamakuru wa Kigali Today/KT Radio
@ SimonKamuzinzi
",https://www.kigalitoday.com/ubuzima/urusobe-rw-ubuzima/Arasabira-ubuvugizi-abana-bafite-ubumuga-bagihishwa-n-imiryango-yabo,Health
Abana barenga ibihumbi 800 bugarijwe n’ingaruka z’imirire mibi,"Mu biganiro ryagiranye n’ubuyobozi bw’intara y’Amajyaruguru ku wa gatatu tariki 30 Ukwakira 2019, iri huriro ryagaragaje ibi biteza igihombo cya miliyari 503 buri mwaka ku musaruro uba ubitezweho.
Abafite aho bahuriye n’inshingano zo kurandura imirire mibi bo mu ntara y’Amajyaruguru, bo basanga hakwiye gukoreshwa buryo bwo kujya mu ngo z’abaturage (urugo ku rundi) bigisha ububi n’ingaruka z’imirire mibi, mu rwego rwo kugabanya umubare w’abakigaragaraho iki kibazo.
Umuyobozi w’akarere ka Gakenke wungirije ushinzwe imibereho y’abaturage, Uwimana Catheline, agira ati “Buri muntu aba afite ukuri kuri mu rugo rwe, hari aho ugera usaba umuryango kurya indyo yuzuye kandi n’ituzuye ntayo babasha kubona.
Aha byazajya bidufasha gutanga umurongo w’uko twunganira abaturage bacu bugarijwe n’imirire mibi, niba ari ukumworoza itungo, niba ari ukumuremera akarima k’igikoni ariko tudahagaze mu nama gusa ngo tubibabwire gutyo gusa. Kugera kuri buri rugo rw’umuturage n ibwo buryo buzadufasha kurandura iki kibazo”.
Umuyobozi w’iri huriro, Mwananawe Aimable, avuga ko hakwiye kugira igikorwa mu gutahiriza umugozi umwe hakomeza gukorwa ubuvugizi, ubushakashatsi no gutanga inama zifasha abaturage gucengerwa n’imyitwarire ibafasha guca ukubiri n’imyumvire ikiri hasi mu buryo bateguramo amafunguro.
Yagize ati “Birasaba ko dukora cyane, uru rugamba tukaruhuriraho mu buryo budasubirwaho. Kugira ngo bizafashe leta mu cyerekezo yihaye cyo kuba nibura mu mwaka wa 2022 ikibazo cy’imirire mibi kizaba cyagabanutse ku rugero rushimishije, tuzabe tubona abana bavuka batugarijwe n’ibibazo byo kugwingira kandi ni ibintu bishoboka dufatanyije”.
Guverineri w’intara y’Amajyaruguru Gatabazi Jean Marie Vianney, avuga ko bagiye gushyira imbaraga mu kwigisha abaturage mu buryo buhoraho uruhare rwabo mu kurwanya imirire mibi.
Agira ati “Hari benshi usanga bafite ayo mafunguro, ariko wajya kureba uko bayategura ugasanga mu by’ukuri ntacyo bakuramo gifitiye umubiri wabo akamaro. Ni ubumenyi bakeneye, noneho bakabwubakiraho bahindura iyo myumvire.
Turasaba abagomba kubibafashamo gusohoka mu biro n’inama za hato na hato, bakabegera mu ngo zabo, bakabibereka”.
Nubwo intara y’Amajyaruguru ifite umwihariko wo kuba igira ubutaka busarurwaho ibihingwa bitunga abayituye n’ibigemurwa ahandi, haba imbere mu gihugu no hanze yacyo, ntibibuza kuba hari abana ibihumbi 91 bari munsi y’imyaka itanu bagwingiye n’ibihumbi 77 by’abana bugarijwe n’ikibazo cyo kutagira ubutare bwa ‘fer’ buhagije mu mubiri biganisha ku mirire mibi.
Iri huriro ritanga inama yo kuba imiryango ikwiye kwita ku gutegura indyo yuzuye, kugira ngo bifashe gukumira hakiri kare ikibazo cy’imirire mibi n’ingaruka zayo.
Umunyamakuru wa Kigali Today/KT Radio
",https://www.kigalitoday.com/ubuzima/urusobe-rw-ubuzima/article/abana-barenga-ibihumbi-800-bugarijwe-n-ingaruka-z-imirire-mibi,Health
Kutamenya amakuru byatumye bamutera inda ku myaka 15,"Muhawenimana wo mu Karere ka Nyarugenge yatewe inda yiga mu mwaka wa kabiri w’amashuri yisumbuye. Avuga ko inda yayitewe n’umunyeshuri biganaga amuhawe na mugenzi we w’umukobwa ariko uwo mukobwa we akaba yakoreshaga uburyo bwo kuboneza urubyaro, mu gihe Muhawenimana we nta makuru kuri byo yari afite.
Muhawenimana ubu ufite imyaka 17, asobanura uko byamugendekeye kugira ngo bamutere inda ndetse akanagaruka ku ngaruka byamugizeho.
Agira ati “Nigaga mu wa kabiri, bigeze mu gihembwe cya kabiri haza umuhungu mushya turigana, akajya aganira n’umukobwa w’inshuti yanjye, nyuma aza ‘kumumpasa’ (aza kumumpa ngo tube inshuti). Uwo mukobwa yaryamanaga n’abahungu ariko ntibamutere inda kuko yabonezaga urubyaro naho jye nta makuru mfite”.
Ati “Uwo muhungu yakomeje kunyereka ko ankunda, akajya anzanira chocolat ku ishuri nkishima hanyuma tuza kuryamana aribwo yanteye inda. Nyuma y’igihe nibwo namenye ko nasamye ndabimubwira ahita abura. Wa mukobwa w’ishuti yanjye yanjyanye ahantu ngo bankuriremo iyo nda ariko ndabitinya, nyuma nza kubyara”.
Uwo mukobwa avuga ko ibyo byatumye ava mu ishuri, cyane ko ngo n’ubundi yigaga bimugoye kuko iwabo batari bifashije, babagaho mu buzima bugoye.
Muhawenimana avuga kandi ko kuva icyo gihe yahuye n’ibibazo bikomeye, kuko iwabo batangiye kumutoteza, bakavuga ko abasebeje ndetse ko ntacyo akibamariye nk’umwana.
Ati “Ntibanyirukanye ariko jyewe na mama, papa yaradukubitaga buri munsi, mbese mu rugo hahoraga induru, akambwira ngo azajya kunjugunya aho kera bajugunyaga abakobwa babyariraga iwabo. Akambwira ngo ubu maze iki? Ngo abana twiganaga ubu bagiye kuyarangiza nanjye nicaye”.
“Hari ubwo papa yaturazaga hanze nyuma yo kudukubita, ariko ubuyobozi bwaje kubimenya bumubwira ko niyongera azafatwa agafungwa. Byatumye agabanya kuntoteza, agenda abireka ariko n’ubu ntikabura kuko namusabye ngo nibura anyishyurire aho nakwiga imyuga akanyihorera”.
Yazize kutamenya amakuru
Muhawenimana avuga ko nyina atigeze amuganiriza ku bijyanye n’ubuzima bw’imyororokere ndetse ko no ku ishuri batabyigaga neza.
Ati “Kugira ngo ntware inda byatewe no kutamenya amakuru kuko mama atampaga umwanya ngo tuganire ngire byinshi menya. Umwalimu watwigishaga iby’ubuzima bw’imyororokere na we ntiyabiduhaga neza, yari umugore akagira isoni umuntu ntagire icyo akuramo”.
“Yafataga nk’umwe mu banyeshuri agashushanya igitsina cy’umugabo cyangwa cy’umugore ku kibaho, akandikaho n’amazina y’ibice bigaragara. Twabwira mwarimu ngo adusobanurire agahita yisohokera ngo nimwisobanurire ni Ikinyarwanda, umuntu akaguma mu bujiji atyo ari ko guterwa inda”.
Akomeza asaba abarimu muri rusange baba abagabo cyangwa abagore, kutagira isoni, bakigisha abana uko bagomba kwifata kuko akenshi ngo ababyeyi hari ubwo baba badasobanukiwe bihagije.
Yumva ko kwemerera abana kuboneza urubyaro ari ngombwa
Kuri Muhawenimana, ngo we yumva mu gihe umwana w’umukobwa apfunduye amabere yakwemerwa kwirinda gusama.
Ati “Ku bwanjye umwana w’umukobwa upfunduye amabere, iyo akoze imibonano mpuzabitsina idakingiye yasama, ni yo mpamvu numva yakwemererwa kugera ku buryo bwo kwirinda atabanje kubisaba ababyeyi. Nanjye iyo mbimenya hakiri kare sinari kuba narabyaye ndi umwana”.
“Muri icyo gihe nibwo utambuka abahungu bagatangira kukwitegereza ari ko bapanga uko bazagushuka. Bagira batya bakakumenyereza ibisuguti, chocolat cyangwa supadipu, cyane ko uba utabasha kubyigurira, bikarangira uguye mu mutego”.
Muhawenimana ubu buhamya bwe yabutangiye mu mahugurwa y’iminsi ibiri ku wa 30 Ukwakira 2019. Ni amahugurwa yateguwe n’umuryango wita ku buzima bw’imyororokere (HDI) ku bufatanye na Imbuto Foundation n’abandi bafatanyabikorwa, akaba yarateguwe muri gahunda yo kurwanya inda zitateganyijwe, cyane cyane mu bangavu.
Umuyobozi wa HDI Dr Aflodis Kagaba, avuga ko inzego zitandukanye zirimo kuganira ku buryo itegeko ryahinduka ku bijyanye n’imyaka abana bahererwaho serivisi zo kuboneza urubyaro badaherekejwe.
Ati “Haracyari imbogamizi ku itegeko kuko umwangavu atemerewe gusaba serivisi kwa muganga atari kumwe n’umubyeyi. Ingimbi n’abangavu akenshi ntibashobora kubwira ababyeyi ko bakora imibonano mpuzabitsina, ni yo mpamvu dusaba ngo itegeko rihinduke niba umwana w’imyaka 15 abikora ahabwe uburyo bwo kwirinda inda atabajijwe umubyeyi”.
Akomeza avuga ko iyo mbogamizi nivanwaho, abana bagahabwa amakuru, imibare y’abangavu baterwa inda nta kabuza izagabanuka ku buryo bugaragara.
Umunyamakuru wa Kigali Today/KT Radio
@ MunyantoreC
",https://www.kigalitoday.com/ubuzima/urusobe-rw-ubuzima/article/kutamenya-amakuru-byatumye-bamutera-inda-ku-myaka-15,Health
Nyuma y’umuganda abapolisi bitabiriye igikorwa cyo gutanga amaraso,"

Iki gikorwa cyabaye nyuma y’umuganda rusange ngaruka kwezi, cyitabirwa n’abapolisi bose bakorera ku cyicaro gikuru cya Polisi y’u Rwanda ku Kacyiru.
Umukozi mu kigo cy’igihugu gishinzwe ubuzima (RBC) ushinzwe kwakira abatanga amaraso, Munyemana André, yavuze ko bishimiye uko iki gikorwa cyagenze, nubwo imvura yabanje kugwa kigasa nk ’igitinda gutangira.
Avuga ko bari bafite impungenge z’uko imvura idatuma igikorwa kigenda neza uko babishakaga.
Yagize ati “Imvura yazindutse igwa twumva ko nta bantu turi bubone, ariko Polisi yagaragaje ubwitange baca muri iyo mvura baza gutanga amaraso”.
Munyemana yavuze ko ashimira Polisi y’u Rwanda cyane uburyo yitabira iki gikorwa kandi bakagikora bagikunze, aboneraho gusaba n’abandi Banyarwanda bose kujya bitabira igikorwa cyo gutanga amaraso kuko ari igikorwa cy’ubugiraneza kandi gitabara benshi.


Yagize ati “Polisi turayishimira ubufatanye bwiza idahwema kutugaragariza n’uburyo batwakira n’uko batwitegura, ntabwo iki gikorwa cyo gutanga amaraso kibera Kacyiru gusa n’ahandi hose mu gihugu hari abapolisi tujyayo bakaduha amaraso. Turashimira Polisi rero ko inezezwa no gucungira abaturage umutekano bafite ubuzima bwiza harimo n’iki gikorwa cyo gutanga amaraso ku bayakeneye”.
Yakomeje avuga ko aya maraso agiye gufasha abantu bayakeneye kandi ko atabara abari mu kaga nk’imbagwa, abantu bahuye n’impanuka, abagore bari kubyara babuze amaraso ndetse n’izindi ndwara zituma umuntu akenera kongererwa amaraso.
Kuva mu kwezi kwa mbere k’uyu mwaka wa 2019, iki gikorwa cyo gutanga amaraso kibaye ku nshuro ya gatatu, kikaba kiba buri nyuma y’amezi atatu.
Abanyamakuru ba Kigali Today
@ kigalitoday
",https://www.kigalitoday.com/ubuzima/urusobe-rw-ubuzima/article/nyuma-y-umuganda-abapolisi-bitabiriye-igikorwa-cyo-gutanga-amaraso,Health
"Indwara y’imbasa ntikigaragara mu Rwanda, ariko gukingira abana ni byo byayirandura","Ubu butumwa bwanagarutsweho ubwo hizihizwaga umunsi mpuzamahanga wo kurwanya imbasa, tariki 25 Ukwakira, mu Karere ka Nyanza.
Nk’uko byasobanuwe na Hassan Sibomana, umuyobozi wa porogaramu y’igihugu y’ikingira, ubundi indwara y’imbasa ikunze kwibasira abana bari munsi y’imyaka 15, ariko cyane cyane abari munsi y’itanu.
Iterwa na virusi ikunze kuba mu mwanda w’umusarane, igafata uwariye cyangwa uwanyoye ibirimo iyo virusi.
Kimwe mu bimenyetso byayo ni ukugira ubumuga butunguranye bw’akaguru kamwe cyangwa yombi, akaboko kamwe cyagwa yombi.
Tamari Umukobwa ufite imyaka 60, avuga ko yayirwaje. Ati “Twarayirwajije, umwana iramumugaza asubira hasi akajya akambakamba kandi yari asigaye agenda. Twaramuvuje, amaze kubona umuti atangira kujya ashinga akaguru, ariko akabavu n’agatako twari twaratwawe. Yaje gukira, ariko ubu ni umugore ugicumbagira”.
Tamari avuga ko uyu mwana wabo yazize kuba atari yarakingiwe, bitewe n’uko bari batuye ahantu mu mashyamba.
Dr. Rosette Nahimana ushinzwe porogaramu yo gukingira mu ishami ry’umuryango w’Abibumbye rishinzwe ubuzima (OMS) mu Rwanda, avuga ko iyi ndwara y’imbasa hari abayirwara ikabahitana, abandi ikabatera ubumuga buhoraho.
Ati “Ku bantu 200 bayanduye, umwe muri bo agira ubumuga buhoraho, abandi uko bavurwa ibimenyetso byayo bikagenda bigabanuka. Kandi hagati ya 5 n’10%, irabahitana biturutse ku kumugara imikaya yo mu buhumekero, bakananirwa guhumeka”.
Dr. Nahimana kandi avuga ko gukingira iyi ndwara ari yo nzira yo kuyirandura burundu, kuko itagira umuti.
Yongeraho ko imbaraga zashyizwe mu kuyikingira abana batoya zatumye abari bayirwaye baravuye ku bihumbi 350 ku isi hose mu mwaka w’1988, bagera ku bihumbi 33 mu mwaka wa 2018.
Naho Dr. Innocent Turate, umuyobozi mukuru ushinzwe gukumira indwara mu kigo gishinzwe ubuzima (RBC), avuga ko gukingira indwara bihendutse kurusha kuzivuza, akaba ari na yo mpamvu igice kinini cy’ingengo y’imari igenerwa RBC ikoreshwa muri porogaramu yo gukingira.
Agira ati “Iyo ubaze umubare w’abantu bakizwa n’uko bakingiwe ni munini cyane ugereranyije n’igiciro cy’urukingo bahabwa ubwarwo”.
Icyakora na none, kugeza ubu mu Rwanda abana batoya bakingizwa inkingo zose baracyari 93%. Ni na yo mpamvu ahamagarira ababyeyi kudasiba n’urukingo na rumwe, kuko ari bwo buryo bwiza bwo kwizera ubuzima buzira umuze ku bana babo.
Umunyamakuru wa Kigali Today/KT Radio
@ JoyeuseC
",https://www.kigalitoday.com/ubuzima/indwara/article/indwara-y-imbasa-ntikigaragara-mu-rwanda-ariko-gukingira-abana-ni-byo-byayirandura,Health
SIDA mu Rwanda yagumye kuri 3% mu myaka isaga 10 ishize,"

Byagaragajwe kuri uyu wa 22 Ukwakira 2019, ubwo Minisiteri y’Ubuzima, biciye mu Kigo cy’igihugu cyita ku buzima (RBC), bashyiraga hanze ubwo bushakashatsi bwatangiye gukorwa mu Kwakira umwaka ushize, bukaba bwarakozwe ku bufatanye n’umushinga w’Abanyamerika wa ICAP.
Ubwo bushakashatsi bwerekanye ko Umujyi wa Kigali uza ku isonga mu kugira abantu benshi bafite virusi itera SIDA kuko uri kuri 4.3%, Intara y’Uburengerazuba ikagira 3.0%, Uburasirazuba bufite 2.9%, Amajyepfo afite 2.9% naho Amajyaruguru akaba ari yo afite umubare muto wa 2.2%.
Ubwo bushakashatsi kandi bwerekanye ko mu Rwanda ubwandu bushya bwa virusi itera SIDA ari 5.400, mu mijyi akaba ari ho hari benshi kuruta mu cyaro, kuko mu mijyi habarwa 4.8% naho mu cyaro hakabarwa 2.5%.


Ubushakashatsi bwakorewe ku bagabo 17.003 n’abagore 14.025 bari hagati y’imyaka 15-64, no ku bana 8.655 bari hagati y’imyaka 10-14.
Umuyobozi mukuru wa RBC, Dr Sabin Nsanzimana wanayoboye ubwo bushakashatsi yavuze ko hari impinduka zagaragaye mu kigero cy’abantu batandukanye.
Yagize ati ""Abanyarwanda bafite virusi itera SIDA bari hagati y’imyaka 15-49 ni 2.6%, ariko ubu bushakashatsi bwarakomeje bugera no ku myaka 64, ari ho bigaragara ko ubwandu buri kuri 3%. Icyiza kirimo rero ku gihugu ni uko ubwandu mu bakiri bato bugenda bugabanuka"".


Yavuze kandi ko umubare w’abandura virusi itera SIDA bashya na wo wagabanutse bigaragara.
Ati ""Muri 2014 abanduraga ku mwaka bari 3/1000, ni ukuvuga abarenga gato ibihumbi 10. Ubu bushakashatsi bwerekanye ko uwo mubare wagabanutse ukaba ugeze kuri 1/1000, ni ukuvuga ko ubu abandura ku mwaka ari 5.400, bagabanutseho 1/2, ni byiza ariko si ibyo kwishimira kuko bakiri benshi"".
Minisitiri w’Intebe Dr Edouard Ngirente, yavuze ko u Rwanda ruhagaze neza mu kurwanya icyorezo cya SIDA.


Ati "" U Rwanda ruri mu nzira nziza iruganisha ku kugera ku ntego za 2020 z’Umuryango w’Abibumbye mu kurwanya SIDA. Imibare yerekana ko u Rwanda rutera intambwe nziza mu kurwanya icyo cyorezo, bigatuma ruba urwa mbere mu kubigeraho"".
Ati ""Twizera ko nidukomeza iyo nzira, tuzakomeza kugera kuri byinshi byiza. Ikindi cyiza ubushakashatsi bwerekanye ni uko umubare munini w’Abanyarwanda bazi uko bahagaze ku birebana n’ubwandu bwa SIDA, ikaba ari intambwe nziza mu gukumira ubwandu bushya"".





Amafoto: Primature
Umunyamakuru wa Kigali Today/KT Radio
@ MunyantoreC
",https://www.kigalitoday.com/ubuzima/indwara/article/sida-mu-rwanda-yagumye-kuri-3-mu-myaka-isaga-10-ishize,Health
AGA-Rwanda Network yahagurukiye abiyita abavuzi gakondo bakorera mu bwihisho,"Urwo rugaga rukomeje gusaba abagikorera mu bwihisho kwigaragaza, bagahugurwa no kwigishwa amategeko agenga umwuga w’ubuvuzi gakondo mu kurushaho guhesha agaciro uwo mwuga.
Mu mahugurwa y’iminsi ine abavuzi gakondo bakoreye mu ishuri rikuru rya INES-Ruhengeri, uwitwa Nyirahabineza Gerturde, ukuriye abavuzi gakondo mu Rwanda yatangarije Kigali Today ko umubare w’abavuzi gakondo bamaze kubarurwa ukiri hasi agereranyije n’abawukora.
Ibyo ngo bikomeje kuba imbogamizi mu migendekere myiza y’uwo mwuga mu gihe hakiri abawukorera mu bwihisho bagamije gushaka indonke mu baturage, aho bikomeje kugira ingaruka ku buzima.
Yagize ati “Kugeza uyu munsi abibaruje bagera ku 1400. Aba icyo tubifuzaho ni ukumenya amabwiriza bagenderaho, birinda guca ibirimi, guca indasago, cyangwa kubyaza kuko ibintu bihuye n’inyama n’amaraso byose ntabwo byemewe ku bavuzi gakondo”.
Akomeza agira ati:“Hari abo twita ba rusahurira mu nduru, batifuza gushyirwa ku rutonde rw’abo dufite ngo bagaragare ko ari abavuzi gakondo kubera kwishakishiriza indonke. Dukomeje kubashakisha tubegera ngo bigishwe kandi dusaba n’inzego zishinzwe umutekano ngo babidufashemo mu guhagarika abo bakomeje kubeshya abaturage babangiriza ubuzima, babarya n’utwabo”.
Nyirahabineza yatanze ingero z’abaturage bagiye bapfa bitewe n’abiyitirira ubuvuzi gakondo bakorera mu bwihisho bakabashukisha imiti idafite ubuziranenge.
Agira ati: “I Burera hari uherutse gukata umwana w’amezi icyenda ikirimi, uwabikoze arafunzwe ariko umwana yarapfuye. Dufite uwa Rutsiro wafashe umugore w’imyaka 23 amuryamisha mu rugo ngo aramukurikirana aramuvura, ntiyigeze yibaruza. Ubu uwo mugore yarahaguye, uwabikoze afungiye i Nyakiriba”.
Abavuzi gakondo 50 basoje amahugurwa yateguwe ku nkunga y’ishuri rikuru INES-Ruhengeri, ku bufatanye n’ishami rya Komisiyo y’igihugu ikorana na UNESCO, AGA-Rwanda Network, NIRDA n’indi miryango inyuranye. Bamwe mu bavuzi gakondo bitabiriye ayo mahugurwa bavuga ko hari byinshi bungutse bizatuma umwuga w’ubuvuzi gakondo ugirira benshi akamaro.
Uwimana Beatha agira ati: “Imbogamizi duhura na zo mu gutegura imiti yacu, ni uko twese tutari ku rugero rumwe. Hari ababyigira ku babyeyi babo, ababyigira mu ishuri n’ababirebera ku bandi. Ariko uburyo twongerewe ubumenyi hari aho bidukura n’aho bitugeza. Hari ubwo bamwe batamenya gutegura imiti yabo, aho batanga n’imiti yagaze ugasanga abaturage bahaburiye ubuzima abandi bakadutakariza icyizere. Ariko izi mbogamizi ziragenda zishira uko duhugurwa”.
Abo bavuzi gakondo kandi barasaba amahugurwa ahoraho, byaba na ngombwa hagashingwa amashuri ya kaminuza yigisha ubuvuzi gakondo, kugira ngo imiti batunganya ikomeze kugirirwa icyizere nk’uko Uwimana Beatha akomeza abivuga.
Ati: “Hakenewe amahugurwa ahoraho, kandi dukeneye ubuvugizi cyane cyane muri Minisiteri y’Ubuzima kugira ngo idufashe umwuga wacu uvugururwe kandi uhabwe agaciro. Habe hajyaho n’amashuri makuru, abana bacu bigishwe ubuvuzi gakondo, kugira ngo bubashe kugira uruhare mu iterambere ry’igihugu cyacu”.
Padiri Dr Hagenimana Fabien, Umuyobozi wa INES-Ruhengeri, ishuri ryagize uruhare muri ayo mahugurwa, yavuze ko iryo shuri ritazahwema gufasha Abanyarwanda hagendewe ku bushakashatsi bukorwa n’ishuri.
Avuga ko ubumenyi iryo shuri ryatanze ku bavuzi gakondo, hari byinshi bubunguye bizabafasha gutera intambwe ibajyana mu ngaga zinyuranye hirya no hino ku isi, bateza imbere umwuga wabo w’ubuvuzi.
Ati: “Kuba amahugurwa yabereye muri INES-Ruhengeri, ni ibyerekana ko inshingano eshatu z’ishuri zijyanye no kwigisha, ubushakashatsi n’ibikorwa biteza imbere abaturage ziri kugerwaho. Ibyo twabigishije birimo gutegura imiti, kuyipima neza hitabwa ku isuku, kumenya ibice by’igiti bibamo umuti, niba ari imizi, igihimba cyangwa ibibabi no kumenya imyitwarire ikwiye mu banyamwuga”.
Akomeza agira ati:“Ubumenyi bajyanye buzabafasha kujya mu rugaga rurenzeho, muri Afurika cyangwa mpuzamahanga kugira ngo bazashobore kugira ijambo mu byo bakora kandi bibatunze”.
Mu mpungenge abavuzi gakondo bagaragaje, harimo ikibazo cyo kutagira icyemezo cy’ubuziranenge cyemewe na Leta bataremererwa, aho bahura n’imbogamizi zijyanye na bamwe mu babagana batabagirira icyizere ndetse n’imiti yabo ikaba itarenga umupaka.
Ndagijimana Osée, umwe mu bohererezwa abarwayi n’ibitaro binyuranye ngo abavure yagize ati: “Duhura n’imbogamizi nyinshi, ariko iya mbere ni uko imiti dukoresha itemerwa. Yemerwa n’abantu bake kandi kutayemera si ukuyizira, ahubwo ni ukutayigirira icyizere kuko tutarabona icyemezo cy’ubuziranenge. Turasaba ko Leta yadufasha ikaduha icyo cyemezo, tukaba twarenga imipaka, imiti yacu ikaba mpuzamahanga”.
Kuri icyo kibazo cyo kuba abavuzi gakondo bavura badafite icyemezo cy’ubuziranenge, Mvunabandi Dominique Umuyobozi ushinzwe ishami ry’ubumenyi n’ikoranabuhanga no guhanga udushya muri Komisiyo y’igihugu ikorana na UNESCO, avuga ko kubona icyo cyemezo bisaba urwego rw’ubumenyi.
Ngo ni yo mpamvu abavuzi gakondo bakomeje gutegurirwa amahugurwa.
Agira ati: “Kugira ngo ubone icyangombwa cy’ubuziranenge, birasaba ko ugomba kuba ufite urwego rw’ubumenyi mu gukora imiti. Twebwe nka komisiyo y’igihugu ya UNESCO, tugarukira mu kongerera ubumenyi buzatuma bakora iyo miti yujuje ubuziranenge. Ni na yo ntumbero tuganamo, murabona ko mu mahugurwa y’iminsi ine bamaze hano yabukakiye ubushobozi kandi iyi ni inshuro ya kane dutegura aya mahugurwa”.
Mu gukomeza guteza imbere ubuvuzi gakondo, ishuri rya INES-Ruhengeri ryamaze guhinga umurima wa hegitari ebyiri urimo amoko 300 y’ibimera, mu rwego rwo gutanga umusanzu ku bavuzi gakondo. Hakaba hateganywa guhingwa ubundi busitani bwisumbuyeho mu rwego rwo kurushaho koroherereza abavuzi gakondo kunoza inshingano bashinzwe.
Umunyamakuru wa Kigali Today/KT Radio
",https://www.kigalitoday.com/ubuzima/ubuvuzi/article/aga-rwanda-network-yahagurukiye-abiyita-abavuzi-gakondo-bakorera-mu-bwihisho,Health
Ubwumvikane buke hagati y’abantu buri mu bitera uburwayi bwo mu mutwe,"

Kutiyakira no kutihangana ni byo bivamo agahinda gakabije (depression). Iyo katavuwe ku gihe, gashobora kuvamo indwara yo mu mutwe ikomeye, bituma uyirwaye ntacyo abasha kwigezaho mu buzima.
Inzobere mu bijyanye n’ubuzima bwo mu mutwe mu bitaro bya kaminuza by’i Kigali (CHUK) Gasana Udahemuka Magnus avuga ko kudaha agaciro umuntu mufite aho muhurira yaba uwo mukorana, umuvandimwe, umubyeyi, umwana bigira ingaruka zikomeye mu buzima bwo mu mutwe.
Yagize ati “Igihe cyo mudashoboye kumutega amatwi, igihe cyose umuntu atanogewe mu isano abanamo n’abandi biragorana bikaba bisaba ko yitabwaho, bituma ubuzima bwo mu mutwe butengamara.”
Ibituma ubuzima bwo mu mutwe buhungabana harimo n’ibyago bitandukanye ndetse no kuba mu muryango w’umuntu hari abigeze guhura n’ubwo burwayi nk’uko yakomeje abisobanura.
Yagize ati “Ubundi umuhangayiko n’ishavu ni bimwe mu bintu byigenzi byatuma ahungabana mu mutwe ariko kimwe nk’izindi ndwara bishobora kuba bifite inkomoko ya kure, iyo hari uwigeze kurwara indwara yo mu mutwe mu muryango haba hari ibyago byinshi by’uko uzamukomokaho ashobora kuzayirwara.”
Raporo y’ishami ry’umuryango wabibumbye ryita ku buzima yashyizwe ahagaragara muri uyu mwaka wa 2019 ivuga ko umuntu umwe kuri bane ku isi afatwa n’uburwayi bwo mu mutwe bivuye ku makimbirane.
Ni mu gihe kandi muri uku kwezi tariki 10 Ukwakira 2019, hizihijwe umunsi wo kurwanya uburwayi bwo mu mutwe butera benshi kwiyahura, aho buri masegonda 40 ku isi umuntu yiyambura ubuzima.
Gasana Magnus usobanukiwe ibijyanye n’ubuzima bwo mu mutwe avuga ko mu buryo bwo guhangana n’ubu burwayi uwagaraje ibimenyetso byo kwigunga, kutumvikana n’abandi, agahinda n’ibindi, yegera inzobere.
Yagize ati “Yegereye inzobere bakaganira, agashira amanga byamufasha kandi tugashimira itangazamakuru riba ryatwegereye kugira ngo abantu basobanukirwe n’iki kibazo cy’indwara zo mu mutwe kuko bibangamira iterambere ry’imiryango.”
Minisiteri y’Ubuzima yo ivuga ko Abanyarwanda bagera kuri 11% babana n’agahinda gakabije, naho mu barokotse Jenoside yakorewe Abatutsi by’umwihariko ababana n’agahinda gakabije bakaba ari 32%.
Umunyamakuru wa Kigali Today/KT Radio
@ Nakurecaissy
",https://www.kigalitoday.com/ubuzima/urusobe-rw-ubuzima/article/ubwumvikane-buke-hagati-y-abantu-buri-mu-bitera-uburwayi-bwo-mu-mutwe,Health
