Title,Body,Url,Category
Inkweto ndende zatera kurwara umugongo,"

Ku rubuga https://www.lepoint.fr , bavuga ko n’ubwo izo nkweto ndende zitazwiho kuba zatera indwara zikomeye, ariko ngo si byiza kuzambara kuko zibangamira ubuzima bwo mu mpiniro z’ingingo( articulations).
Kwambara inkweto zifite ‘talon’ ndende, ni ukuvuga zifite talon irengeje uburebure bwa sentimetero 10, bituma ikirenge kiremererwa ku gice cy’imbere kuko kiba gisabwa kwikorera 90 % by’ibiro by’umuntu byose.
Kuri urwo rubuga bavuga ko n’ubwo hari abagore n’abakobwa bafata inkweto zifite talon nk’intwaro umuntu wese ushaka kugaragara neza yakwitwaza, ariko abenshi bamaze kumva ko ari mbi ku buzima bwabo.


Ikibazo gikomeye gihari, ni uko ikirenge kitaba kigishoboye kwikorera ibiro by’umubiri w’umuntu uko byagombye kugenda. Ubundi ngo iyo umuntu agenda ibirenge birambuye neza ku butaka, ikirenge kiba cyikoreye ibiro ku buryo butangana.
Ni ukuvuga ko igice cy’imbere cy’ikirenge cyikorera 40% by’ibiro by’umubiri w’umuntu, mu gihe igice cy’inyuma ku gitsinsino cyikorera 60% by’ibiro by’umuntu byose.
Iyo umuntu yambaye inkweto zifite talon ndende rero, igice cy’imbere cy’ikirenge, cyikorera uburemere kitagombye kwikorera, kuko hari n’ubwo usanga cyikoreye 90 % by’ibiro by’umuntu, iyo inkweto zifite talon irengeje santimetero 10.
Iyo umuntu yambaye urukweto rufite talon ya santimetero 6 z’uburebure, igice cy’imbere cy’ikirenge kiba cyikoreye 75 % by’ibiro byose by’umuntu, kandi ibyo ni byinshi ugereranyije n’ibyo cyagombye kwikorera.


Indi ngaruka yo kwambara inkweto ndende ni uko amano agenda yangirika ku buryo bishobora no kurangira umuntu agiye kwa muganga bigasaba ko bamubaga kugira ngo amano asubire uko yahoze mbere.
Kwambara inkweto ndende kandi, bitera kubabara mu tugombambari (chevilles), mu mavi ndetse no mu rukenyerero. Akenshi uko kubabara mu mavi bigorana iyo umuntu azamuka cyangwa amanuka ku ngazi “Escalier”.
Kwambara inkweto ndende kandi byangiza uruti rw’umugongo “Colonne vertébrale”, kuko iyo umuntu azambaye ibiro byinshi biba byahengamiye ku gice cy’imbere.
Ku rubuga https://www.simplemost.com, bavuga ko mu bibi biterwa no kwambara inkweto ndende harimo kuba zangiza inzara z’amano, kuko amano aba yifungiye hamwe,kandi akenshi yitsindagiye mu rukweto, bituma inzara zikura zinjira mu mubiri cyane cyane iz’amano y’ibikumwe, hari n’ubwo bituma zirwara zikazamo n’amashyira, bikaba bishobora no gutuma kwa muganga bazibaga kugira ngo bazikuremo.


Hari kandi no kuba inkweto ndende cyane cyane izifunze zitera amabavu ku mano. Iyo umuntu ayasanganywe noneho birushaho kuba bibi kuko ariyongera.
Inkweto ndende kandi uretse kuba zituma umuntu ababara mu mavi, hari no kubabara mu magufa yo matako.
Kuri urwo rubuga bagira abantu inama yo kwambara inkweto zituma ikirenge kiba cyirambuye ku buryo gishobora kwikorera ibiro by’umuntu uko bikwiriye.
Umunyamakuru wa Kigali Today
@ umureremedia
",https://www.kigalitoday.com/ubuzima/indwara/article/inkweto-ndende-zatera-kurwara-umugongo,Health
"Ubuzima 2019: Ebola yakanze benshi yabonewe urukingo, SIDA ntiyiyongereye","Iyo ndwara ubundi yari imaze igihe kinini iri mu gace ka Butembo muri RDC, icyo gihe ntiyari iteye inkeke ku Rwanda. Muri Mata uyu mwaka ni bwo umuntu uyirwaye yageze i Goma iranamuhitana, bityo abatuye i Rubavu bagira ubwoba, ni bwo Minisiteri y’Ubuzima yatangiye gushyira ingufu mu kuyikumira.
Hashyizweho ingamba zirimo gupima iyo ndwara buri muntu uvuye muri Kongo mbere y’uko yinjira mu Rwanda, ndetse hanubakwa za robine zo gukarabiraho, zifite amazi arimo umuti kuko ngo kwirinda Ebola ahanini ari ukugira isuku, Abanyarwanda banakangurirwa kugabanya ingendo zijya muri icyo gihugu.


MINISANTE yakurikijeho gukingira abantu begereye umupaka biganjemo abo mu nzego z’ubuzima, abapolisi n’abandi ku buryo mu mpera za Nyakanga hari hamaze gukingirwa abasaga 3000, ku nkunga y’ikigo MERCK cyo muri Leta zunze Ubumwe za Amerika, icyo gihe urwo rukingo rukaba rutari rwemerwa.
Abaminisitiri b’Ubuzima ku mpande zombi banashyize umukono ku masezerano y’ubufatanye mu kurwanya Ebola.
Kugeza ubu nta murwayi wa Ebola wigeze ugaragara mu Rwanda, icyakora MINISANTE ikomeje kuyirinda Abanyarwanda, aho ubu hari gahunda yatangiye yo guha urukingo abantu babyifuza muri gahunda yiswe ‘Umurinzi’, bikaba byarahereye mu Turere twa Rubavu na Rusizi, kandi urwo rukingo noneho rukaba rwaremejwe n’ishami ry’Umuryango w’Abibumbye ryita ku buzima (WHO).
SIDA mu Rwanda ntiyiyongereye mu myaka 10 ishize
Ubushakashatsi bwiswe RPHIA bwakozwe na MINISANTE ku bufatanye n’abafatanyabikorwa nk’umushinga w’Abanyamerika wa ICAP n’abandi, bwatangiye mu Ukwakira 2018, bwerekanye ko ubwandu bwa SIDA mu Rwanda bwagumye kuri 3% nk’uko byari bimeze mu myaka 10 ishize.
Icyakora bwerekanye ko Umujyi wa Kigali uza ku isonga mu kugira abantu benshi bafite ubwandu bwa virusi itera SIDA, kuko uri kuri 4.3%, Intara y’Uburengerazuba ikagira 3.0%, Uburasirazuba bukagira 2.9%, Amajyepfo 2.9% naho Amajyaruguru akagira 2.2%.
Icyakora ubwo bushakashatsi bwagaragaje ko SIDA yagabanutse mu bantu bari hagati y’imyaka 15-45, kuko iri kuri 2.6%, ibyo ngo bikaba ari ibyo kwishimira nk’uko bitangazwa na Dr. Sabin Nsanzimana, umuyobozi wa RBC.
Ati “Muri rusange ubwandu bwagumye kuri 3%, ariko icyiza twishimira nk’igihugu ni uko yagiye igabanuka mu bakiri bato, ni ukuvuga abari hagati y’imyaka 19-45, kuko iri kuri 2.6%”.
U Rwanda rwakiriye inama mpuzamahanga kuri SIDA (ICASA)
Iyo nama yabereye muri Kigali Convention Center kuva ku ya 2-7 Ukuboza 2019, ikaba yari igamije kureba uko icyorezo cya SIDA gihagaze muri Afurika, n’ingamba zihari zo kugihashya kugira ngo muri 2030 izabe yacitse burundu nk’uko biri mu ntumbero z’isi.
Atangiza iyo nama, Perezida Kagame yavuze ko abantu bose bagombye gukorera hamwe kugira ngo bahashye icyorezo cya SIDA, ari yo mpamvu ari ngombwa kuvuga ibyacyo.
Yagize ati “Ibiganiro birinda ubuzima, akato no guceceka byica nk’uko virusi z’indwara ubwazo zica. Isoni zica intege abantu bafite virusi itera SIDA, bityo ntibamenye cyangwa ngo bemere uko bahagaze kugira ngo bajye mu bigo by’ubuzima bityo bafashwe kubaho igihe kirekire. ICASA rero iriho kugira ngo ikureho imigenzo ibuza kwirinda no kuvurwa hakiri kare”.
Muri iyo nama byagaragajwe ko mu Rwanda hejuru ya 90% by’abafite virusi itera SIDA bazi uko bahagaze, muri bo 98% bari ku miti igabanya ubukana, naho 90% byabo ntabwo virusi za SIDA zigitembera mu maraso.
Ibyo bituma u Rwanda ruza mu bihugu bike byageze ku ntego ya WHO ya 90-90-90 igomba kugeza muri 2020.
Iyo nama yitabiriwe n’abayobozi batandukanye barimo Perezida Philipe Nyusi Jasinto wa Mozambique, bamwe mu bafasha b’abakuru b’ibihugu bya Afurika bibumbiye mu ihuriro bise OAFLAD n’abandi bayobozi batandukanye.
Madame Jeannette Kagame yasangije abitabiriye ICASA ibyo u Rwanda rwakoze kugira ngo SIDA itiyongera, kuko ubwandu bushya bwagabanutseho 83%.
Ati “Imishinga yacu ijyanye n’ubuzima bw’imyororokere yafashije ingimbi n’abangavu kumenya amakuru y’aho basanga ubuvuzi n’izindi serivisi zafasha urubyiruko. Ibyo ni byo byatumye habaho igabanuka ry’ubwandu bushya bwa virusi itera SIDA mu rubyiruko”.
Ati “Byanagize uruhare rukomeye mu ntambara yo kurwanya SIDA n’izindi ndwara zandurira mu mibonano mpuzabitsina mu gihugu no ku mugabane wa Afurika muri rusange. Mu Rwanda rero kugera mu mpera za 2018, ubwandu bushya bwaragabanutse kugera kuri 83%, na ho impfu zishamikiye kuri SIDA zigabanuka kugera kuri 82%”.
Ingabo zavuye Uwimana ikibyimba kidasanzwe ku buntu
Muri Gashyantare 2018, ni bwo Kigali Today yanditse inkuru y’ubuvugizi, aho yagaragaje uburwayi bw’umugore wo mu Karere ka Musanze witwa Uwimana Jeanne, warwaye ikibyimba mu maso kimupfuka isura, arivuza birananirana, bituma umuryango we umuha akato ndetse n’umugabo we aramuta.
Nyuma y’ubwo buvugizi, Ibitaro bya Gisirikare bya Kanombe byiyemeje kuvura uwo mubyeyi, cyane ko kuva muri 2011 iyo ndwara yamufata, yivuje ageze aho arabireka kuko nta n’ubushobozi yari asigaranye.
Tariki 23 Gashyantare 2018, ni bwo Uwimana yagejejwe ku Bitaro bya Gisirikare i Kanombe, asuzumwa na Capt. Jean Paul Shumbusho, ku munsi ukurikiyeho ahita amubaga cya kibyimba, birangiye akanguka afite isura ye ya kera, agashimira cyane abamufashije.
Nyuma y’umwaka Uwimana avuwe n’ingabo z’u Rwanda, ubu ameze neza, akazishimira ko zamurokoye bwa kabiri.
Ati “Ingabo nazinganya iki? Nyuma yo kumbohora nk’Umunyarwanda, zarongeye zinkiza urupfu rwari runsatiriye. Sinabona icyo nazitura kuko jye numva nari kuba narasezeye ku isi”.
Dr. Karekezi, Umunyarwandakazi wa mbere ubaga ubwonko
Dr. Claire Karekezi w’imyaka 35, yagarutsweho cyane n’ibitangazamakuru binyuranye muri uyu mwaka, nk’umwe mu nzobere nke ziri mu Rwanda mu kubaga ibibyimba bifata ku bwonko, akaba ari n’igitsina gore.
Dr. Karekezi yize ubuganga muri kaminuza y’u Rwanda arangiza muri 2009, nyuma yaje kubona amahirwe yo kwihugura mu kubaga mu mutwe muri kaminuza ya Oxford mu Bwongereza.
Muri 2011 yagiye kongera ubumenyi mu kigo gihugura abaganga bakiri bato bavura indwara zifata ubwonko cyo muri Maroc abifashijwemo na Leta y’u Rwanda, asohoka ari impuguke yuzuye, ndetse yaje gukomereza kwihugura muri Canada no muri Amerika.
Nyuma yaje kugaruka mu Rwanda, kuva muri Mutarama uyu mwaka akaba akorera mu bitaro bya gisirikare bya Kanombe.
Mu gihe kitaragera ku mwaka amaze muri ibi bitaro, yakiriye abarwayi 2000 ariko akaba amaze kubaga abagera kuri 80.
Perezida Kagame yahembewe kwita cyane ku buzima bw’abaturage
Umuryango Nyafurika wita ku buvuzi n’ubushakashatsi (AMREF), uherutse guha igihembo Perezida wa Repuburika Paul Kagame, cy’uko yabaye umuyobozi w’indashyikirwa wita ku buzima bw’abaturage ayobora, ndetse agafatwa nk’intangarugero muri Afurika.
Perezida Kagame yahawe icyo gihembo ubwo mu Rwanda hateraniraga inama mpuzamahanga ku buzima muri Afurika, inama yatangiye ku ya 5 Werurwe 2019, ikaba yaramaze iminsi itatu.
Icyo gihembo kikaba cyaratanzwe na Dr. Githinji Gitahi, Umuyobozi Mukuru wa AMREF, cyakirwa na Minisitiri w’Ubuzima, Dr. Diane Gashumba.
Dr. Githinji yagize ati “Iki ni icyerekana ko yabaye umuyobozi mwiza mu rwego rwa politiki no kugaragaza ibikorwa byagezweho muri gahunda y’ubuzima kuri bose mu Rwanda”.
Ubu u Rwanda ruri mu bihugu biri imbere mu kubungabunga ubuzima no kugera ku ntego za gahunda y’ubuzima kuri bose, kuko ubu rugeze kuri 17% by’ingengo y’imari y’igihugu ya buri mwaka bijya mu buzima.
90% by’abaturage bakba bose bafite ubwishingizi bw’ubuzima, ari na byo bishimangira impamvu z’icyo gihembo.
Ibitaro 20 byahawe imbangukiragutabara nshya
Umuryango Imbuto Foundation wahaye Minisiteri y’Ubuzima (MINISANTE) imbangukiragutabara 20 mu rwego rwo kuyunganira, hagamijwe guha serivisi nziza abarwayi kuko izihari ari nke ndetse harimo n’izishaje.
Umuhango wo gutanga izo mbangukiragutabara wabaye ku itariki 22 Ugushyingo 2019, MINISANTE ihita izishyikiriza abayobozi b’ibitaro zagenewe kugira ngo zihite zitangira akazi kuko zari zikenewe cyane, imwe muri zo ikaba ifite agaciro ka miliyoni 54 z’Amafaranga y’u Rwanda.
Umuyobozi mukuru muri MINISANTE ushinzwe ibikorwa by’ubuvuzi n’ubuzima rusange, Dr. Zuberi Muvunyi, avuga ko imbangukiragutabara mu gihugu zikiri nke, kuko mu mahame mpuzamahanga imwe ifasha abantu ibihumbi icumi, mu gihe mu Rwanda hari izigera kuri 300 gusa kandi muri zo harimo izishaje zitakimeze neza nk’uko byifuzwa.
Umunyamakuru wa Kigali Today/KT Radio
@ MunyantoreC
",https://www.kigalitoday.com/ubuzima/urusobe-rw-ubuzima/article/ubuzima-2019-ebola-yakanze-benshi-yabonewe-urukingo-sida-ntiyiyongereye,Health
Menya uko amakara yagufasha gukesha amenyo,"

Ku rubuga www.healthline.com , bavuga ibyiza byo gukoresha amakara neza harimo kuba akesha amenyo, akayakuraho ibizinga, no gutuma umuntu agira umwuka wo mu kanwa uhumura neza.
Gusa icyo kuba akuraho ibizinga ku menyo, bavuga ko ibyiza ari uko yakoreshwa nyuma y’uko umuntu yavuye kuyogesha kwa muganga wabyize, kandi agakoreshwa rimwe na rimwe.
Ku rubuga https://www.santemagazine.fr/ basobanura ko n’ubwo amakara azwiho kuba akesha amenyo, ibyiza ari ukuyakosha uko bikwiriye, kuko bitabaye ibyo, ashobora no kwangiza amenyo.
Bavuga ko iyo amakara akoreshejwe igihe kirekire mu koza amenyo, ashobora kwangiza ubuzima bw’amenyo, akavanaho akantu kaba ku menyo kayarinda kakanatuma arabagirana kitwa “émail”,.
Ikindi kandi ngo amakara akoreshejwe igihe kirekire ashobora gutera ibizinga ku menyo cyangwa no ku rurimi. Ibyiza rero ni uko mbere yo kuyakoresha umuntu yabanza kubaza umuganga w’amanyo.
Ikibazo gikomeye ni uko ako kantu gatwikira amenyo kitwa “émail”, iyo kangiritse biba birangiye ntikagaruka nk’uko bigenda ku ruhu cyangwa se ku magufa, kuko iyo umuntu akomeretse ku ruhu ashobora gukira, uruhu rukongera rukamera rugaterana ndetse n’amagufa ashobora kuvunika nyuma agaterana.
Kuri urwo rubuga bavuga ko ubushakashatsi bugikomeje, kugira ngo barebe niba hari ikindi kibazo cyaba giterwa no kogesha amenyo amakara. Ariko bajya inama ko mu gihe ubushakashatsi bukomeje, umuntu yajya akoresha amakara inshuro itarenze imwe mu kwezi.
Ku rubuga www.healthline.com, bvauga ko muri iki gihe ubucuruzi bukorerwa kuri interineti bugenda butera imbere, amakara na yo ndetse n’imiti ikozwe mu makara, ikaba iri mu bikunze gucuruzwa kuri interineti kubera abayakoresha mu kwita ku ruhu rwo mu maso (masks), n’abayakoresha mu koza amenyo kugira ngo arusheho kuba umweru.
Kuri urwo rubuga bavuga amakara yakozweho ubushakashatsi buhagije ndetse ubu hari abayakoresha mu kwivura indwara zinyuranye, ariko ubushakashatsi ku bijyanye n’ukuntu amakara atuma amenyo arushaho kwera ngo buracyari buke.
Gusa ngo ikizwi ni uko amakara akoreshejwe neza afasha mu kuvana ibizinga ku menyo.
Umunyamakuru wa Kigali Today
@ umureremedia
",https://www.kigalitoday.com/ubuzima/urusobe-rw-ubuzima/article/menya-uko-amakara-yagufasha-gukesha-amenyo,Health
Kutubahiriza amabwiriza yo gufata imiti byongera impfu,"Babigaragarije mu biganiro nyunguranabitekerezo byateguwe n’ishuri rikuru rya INES-Ruhengeri, mu rwego rwo kurwanya ibibazo bya mikorobe zikomeje kwiyongera ari nako zugarije abaturage zinabatwara ubuzima.
Ni ikiganiro cyateguwe ku nsanganyamatsiko igira iti ‘The future of Antibiotics depends on all of us’.
Nk’uko Padiri Dr. Hagenimana Fabien, Umuyobozi wa INES-Ruhengeri yabitangarije Kigali Today, ngo ikibazo gihangayikishije isi, ni imbaga y’abantu ikomeje gupfa kubera mikorobe zivuka ari nyinshi mu mubiri, zikarenga ubushobozi bw’imiti.
Yavuze ko icyo kibazo gikururwa no kudasobanukirwa kw’abaturage mu gufata imiti bahabwa hirya no hino mu mavuriro aho bayifata mu buryo butemewe bikabaviramo ibibazo.
Agira ati “Ni ikibazo gihangayikishije isi, bakurikije uburyo mikorobe zigenda ziyongera mu mu biri wa muntu, barasanga mu myaka 15-20 nta muti uzaba ukivura kubera ko uko mikorobe zigenda zimenyera mu buryo ubu n’ubu, ariko uyiha umuti wari usanzwe wayica bikanga.
Ni ikibazo tugomba kumva kimwe, ari abize, ari abatarize, ari abakora mu mavuriro natwe tuyobora ibigo nk’ibi, kugira ngo abantu bumve uburyo bwo gufata imiti bwabavura”.
Akomeza agira ati “Hari ubwo umuntu arwara agafata ‘antibiotic’ iyi n’iyi, akanywa ndetse yakumva yorohewe akarekeraho akabika, yahura na mugenzi we urwaye indwara nk’iye akamuhaho, bagakomeza kwinywera umuti nta wawupimye.
Hari n’abanywera alukoro (alcohol) kuri iyo miti, umubiri ukamenyera utyo kugeza ubwo umuti wazana wose udashobora kuvura umuntu, kubera ko mikorobe zabaye inshuti na ya miti ufata mu buryo butemewe, bikarangira umuntu apfuye”.
Mu bushakashatsi bwakozwe n’abanyeshuri biga iby’ubuvuzi (Biomedical Laboratory sciences) muri INES-Ruhengeri, bwagaragaje ko na bo bagiye bahura n’ibyo bibazo by’abaturage bagezweho n’ingaruka zo gufata imiti nabi bikarangira bapfuye.
Doroth Nantari, usoza amasomo muri INES-Ruhengeri, avuga ko mu bushakashatsi yakoze yibanze ku buryo abaturage bafata imiti, aho yasanze batazi kuyikoresha, batazi n’ingaruka zo kuyikoresha nabi.
Ati “Nasanze antibiotic bazizi, ariko batazi kuyikoresha, batazi n’ingaruka zo gufata iyo miti nabi, umuturage baramuha imiti yakumva agaruye akabaraga ugasanga ntiyongeye kuyikoza, ibyo bituma mikorobe zikomeza kuvukira mu mubiri bikarangira nta muti ukibasha uburwayi”.
Nasanze avuga ko abaganga na bo bagenda babigiramo uruhare, aho usanga badasobanurira abarwayi uko bafata imiti bahawe, ibyo bigatuma umuturage atagira ubumenyi bw’uburyo yafata imiti yahawe, ari ho hava bya bibazo byo kutayiha agaciro ngo yumve ko akwiye kuyinywa akayimara.
Ati “Ntabwo abaganga abasobanurira abaturage uko bafata imiti bahawe, no muri za laboratwari, usanga iyo umuganga agiye gufata ibizamini atabanza gusobanurura umurwayi impamvu yabyo.
Birakwiye ko mbere yo gufata umurwayi ibizamini ubanza kumusobanurira impamvu yabyo, ndetse na wawundi ushinzwe gutanga imiti akaganiriza umurwayi ahereye ku bizamini umuganga yamwandikiye, kugira ngo avurwe neza”.
Kabare Isaie Wiga mu mwaka wa kane muri Biomedical Laboratory Sciences, agira ati “Nk’uko babigaragaje, muri 2050 umubare w’abantu bazaba bicwa n’indwara zagombye kuba zivurwa uzaba wariyongereye cyane. Ni yo mpamvu ibi biganiro biriho kugira ngo twirinde kuzatakaza abantu kandi hakabayeho kwirinda”.
Akomeza agira ati “Hari abafata imiti mu kajagari, ugasanga ayifashe itari ngombwa. Umuturage baramuha imiti yakwiyumvamo ko atoye akabaraga agahita ajugunya iyo yari asigaje cyangwa akayiha undi. Ibyo ni ukwiyica, cyane kuko aba ahaye icyuho za bagiteri kuko igihe wahawe imiti ugomba kuyimara”.
Ibyo biganiro byitabiriwe n’impuguke zinyuranye mu bitaro by’icyitegererezo byo hirya no hino mu gihugu, byagaragaje ko ikibazo kinini kikiri ku myumvire mike y’abaturage aho bataramenya neza ingaruka zo gufata imiti nabi nk’uko Jean Pierre Uwizeyimana, ukora muri Laboratwari yo mu bitaro byitiriwe Umwami Faycal abivuga.
Agira ati “Ntabwo nakwemeza ko ibyo bibazo by’abaturage biterwa n’abaganga badasobanurira abarwayi. Ntekereza ko umuganga mbere yo gutanga umuti abanza kuganiriza umurwayi, akamusobanurira uko ayifata.
Nkeka ko ari ubumenyi buke bw’abaturage, umuntu yakumva ahembutse akumva ko yakize, birasaba inyigisho zifasha abaturage gusobanukirwa neza akamaro ko gufata imiti neza, n’ingaruka zo kuyifata nabi”.
Mu myanzuro yafatiwe muri iyo nama, harimo ko ibiganiro byiga kuri icyo kibazo bizakomeza. Ikindi hagategurwa ubukangurambaga mu bigo byose bikora ibikorwa by’ubuvuzi, hagamijwe kurushaho guhugurira abaturage gufata imiti mu buryo bwemewe, mu kubarinda ibyago byakururwa no gukoresha nabi imiti bahabwa mu mavuriro anyuranye.
Umunyamakuru wa Kigali Today/KT Radio
@ mutuyiserv
",https://www.kigalitoday.com/ubuzima/ubuvuzi/Kutubahiriza-amabwiriza-yo-gufata-imiti-byongera-impfu,Health
Abavuzi gakondo barifuza ko itegeko ribagenga ryakwihutishwa,"Kubwayezu w’umuvuzi gakondo ukorera mu Karere ka Gasabo, avuga ko ababazwa no kuba nk’abavuzi gakondo hari ababitiranya n’abapfumu cyangwa abarozi, nyamara umurimo bakora wo kuvura ntaho uhuriye na byo.
Agira ati “Abatwita abarozi ni abatazi ko abavuzi gakondo tujya tubasha kuvura n’indwara imiti ya kizungu yananiwe, harimo umwijima na diyabete”.
Ibyo avuga bishimangirwa na Gerturde Nyirahabineza, uyobora urugaga rw’abavuzi gakondo mu Rwanda. We avuga ko umwuga wabo wicwa n’abawiyitirira batazi iyo bigana.
Agira ati “Muri iyi minsi dufite ikibazo cy’abirukanwa mu kazi cyangwa babura ibyo bakora bakirukira mu buvuzi gakondo. Kandi ubuvuzi gakondo ni impano. Hari n’ababyiga bakabimenya, ariko na none si ugupfa kwiyita umuvuzi gakondo”.
Ibi kandi ngo bikurura akajagari mu buvuzi gakondo nk’uko Nyirahabineza akomeza abivuga, agira ati “Hari abo usanga mu isoko bahamagara ngo ncuruza umuti w’inzoka, umuti w’igifu, umuti w’impyiko.
Kandi ncuruza n’umuti wo gutera akabariro ndetse n’ibinyenzi. Umuti w’abantu n’uw’ibisimba ugasanga ni ibintu bihabanye. Ni akajagari. Rwose umuti wagiye ku zuba uba wamaze kuba uburozi, mu isoko ntibyemewe kuyihacuririza”.
Avuga ko n’abiha kubyaza, abakura ibyinyo n’abaca ibirimi na bo batemewe.
Abavuzi gakondo bavuga ko umuti w’ingenzi wavugutwa kuri iki kibazo cy’akajagari mu buvuzi gakondo mu Rwanda, ari ugushyiraho itegeko rigenga uwo mwuga, nk’uko bivugwa na Nyirahabineza.
Ati “Akajagari gaterwa n’abitwaza ko nta tegeko ribahana ririho. Ryihutishijwe byarushaho kuba byiza kuko ari byo byakuraho kuvangirwa n’abamamyi n’abatekamutwe”.
Dr. Charles Karangwa, Umuyobozi Mukuru w’Ikigo gishinzwe kugenzura imiti n’ibiribwa mu Rwanda (Rwanda FDA), avuga ko akajagari mu bucuruzi bw’imiti gakondo batakemera n’ubwo itegeko ribugenga ritarasohoka, kuko ubu rigeze mu Nteko Ishinga Amategeko.
Ati “Ngira ngo mwumvise umukwabu (operation) yakozwe na polisi ifatanyije na RIB ukoreshwejwe na FDA ifatanyije na Minisiteri y’Ubuzima, yo guhagarika imiti yose ikoreshwa mu buryo bw’akajagari wasangaga hirya no hino mu masoko, babeshya abaturage bababwira ngo uyu muti uvura ibi n’ibi kandi atari byo”.
Uyu muyobozi anavuga ko kugira ngo ubundi hemezwe ko umuti uvura indwara runaka, hagomba kuba hazwi ibiwurimo bitagira ingaruka ku buzima. Kandi ngo hari abavuzi gakondo bamaze gupimisha imiti yabo mu bigo by’ubushakashatsi ku buryo bazi ibiyigize.
Urugero atanga ni umusaza witwa Batura wo mu Murenge wa Tumba mu Karere ka Huye, ufite inyunganiramirire aha abana bafite imirire mibi bagakira. Imiti ye ngo abayipimye basanze irimo imyunyu na za vitamine zizwi.
Abafite imiti yamaze gupimwa nk’uyu musaza, hakaba hazwi ibiyigize, itegeko nirijyaho ngo iki kigo kizabaheraho mu gutanga uruhushya rwo gukora no gutanga imiti gakondo.
",https://www.kigalitoday.com/ubuzima/ubuvuzi/article/abavuzi-gakondo-barifuza-ko-itegeko-ribagenga-ryakwihutishwa,Health
Konsa byarinda umubyeyi indwara z’umutima na diyabete,"

Urubuga www.medela.fr, rusobanura akamaro ko konsa n’icyo bifasha umubyeyi wonsa uko bikwiriye.
Abahanga bavuga ko umwana agikoza umunwa ku ibere rya nyina bwa mbere, umubiri uhita uvubura umusemburo witwa ‘ocytocine’, ari wo utuma umwana na nyina bamenyerana cyane, bakanakundana. Uwo musemburo rero wiyongera uko umwana yonse.
Muri iyi nkuru murabona ibyiza byo konsa cyane cyane ku mubyeyi. Muri ibyo harimo kuba bifasha nyababyeyi y’umubyeyi umaze kubyara gusubira mu mwanya wayo neza kandi vuba.
Kubera ko konsa umwana bifasha nyababyeyi gusubira mu mwanya wayo vuba ndetse no kwiyegeranya, ni yo mpamvu iyo umubyeyi agize ikibazo cyo kuva cyane nyuma yo kubyara, abaganga bihutira gushyira umwana ku ibere kugira ngo bifashe nyababyeyi gusubira mu mwanya wayo vuba vuba, bityo no kuva bigahagarara.
Nyababyeyi y’umubyeyi wonsa umwana we neza, isubirana vuba ugereranije n’iy’umubyeyi utonsa. Umusemburo wa ‘ocytocine’ ukorwa n’umusemburo w’umubyeyi mu gihe yonsa, umurinda kuba yagira ikibazo cy’amaraso make kuko utuma adashobora kongera kuva nyuma yo kubyara.
Uko umubyeyi yonsa umwana igihe kirekire, ni ko yiyongerera ibyiza bizanwa no konsa, nk’uko impuguke mu by’ubuzima, Prof. Hartmann, abisobanura.
Avuga ko ukwezi kose kwiyongera ku mezi yo konsa gufasha umubyeyi kugabanya ibyago byo kurwara za kanseri zitandukanye harimo, kanseri y’ibere , kenshi ifata intanga z’abagore ndetse na kanseri ifata nyababyeyi.
Nubwo hari ababyeyi bagorwa no konsa cyane cyane mu gihe bakimara kubyara, ni ibintu birangira mu byumweru bike uko umwana agenda amenyera konka.
Icyiza cyo konsa kandi ni uko nta yindi myiteguro bisaba, uretse gutamika umwana ibere gusa.
Konsa bifasha ababyeyi mu kuboneza urubyaro, kuko bibuza umugore kuba yasama, bikaba rero ni uburyo bwo kuboneza urubyaro bukora kandi bwizewe ku kigero cya 98 %, mbese byizewe kimwe no kunywa ibinini byagenewe kuboneza urubyaro.
Konsa bifasha umubyeyi kugabanya ibiro, akenshi byiyongera mu gihe umuntu atwite.
Iyo umubyeyi yonsa bigereranywa no gukora siporo, ibinure umubyeyi wonsa atakaza ku munsi, bingana n’iby’umuntu ukora siporo yo kugenda ku igare atakaza mu gihe cy’isaha.
Ku rubuga www.parents.com, bavuga ko konsa bigira akamaro kanini ku babyeyi, harimo no kubarinda indwara zitandukanye harimo n’indwara z’amagufa zikunze kwibasira abagore bakuze batakiri mu kigero cyo kubyara (menopause).
Kuri urwo rubuga basobanura ko iyo umubyeyi atwite cyangwa yonsa, umubiri we winjiza ubutare bwa kalisiyumu (calcium), iyo calcium rero ni yo ikomeza amagufa cyane cyane ayo mu mugongo n’ayo mu matako.
Iyo umugore abona calcium ihagije amagufa arakomera bikamurinda ibyago byo kuzarwara indwara ifata amagufa yitwa ‘osteoporosis’, igatuma yoroha cyane ku buryo yanavunagurika mu buryo bworoshye.
Ku rubuga www.healthline.com, bavuga ko nubwo hari ababyeyi bamwe badashobora konsa bitewe n’uko bidakunda cyangwa ari ko babihisemo, ariko konsa bifite ibyiza ntagereranywa ku mubyeyi ubikora neza.
Mu byiza byo konsa basobanura harimo kuba bigabanyiriza umubyeyi wonsa ibyago byo kurwara indwara zitandukanye harimo kugabanya ibyago byo kurwara diyabete yo mu bwoko bwa mbere ku kigero cya 30% na diyabete yo mu bwoko bwa kabiri ku kigero cya 40%.
Ikindi cyiza cyo konsa ku babyeyi ni uko bibafasha mu kugabanya ibiro mu buryo bwiza kandi butangiza buzima.
Umunyamakuru wa Kigali Today
@ umureremedia
",https://www.kigalitoday.com/ubuzima/urusobe-rw-ubuzima/article/konsa-byarinda-umubyeyi-indwara-z-umutima-na-diyabete,Health
