Title,Body,Url,Category
Gukaraba intoki uko bikwiye byakurinda indwara zirimo na Coronavirus,"Iki ni icyorezo cyugarije isi guhera mu ntangiriro z’uyu mwaka wa 2020, kikaba kimaze guhitana abarenga 3.000 hirya no hino ku isi mu mezi abiri gusa.
Uburyo intoki zishobora gukwirakwiza indwara no kwirinda hitawe ku muco wo gukaraba intoki urabisobanukirwa muri iyi nkuru.
Amakuru dukesha ibinyamakuru bitandukanye byandika ku buzima, avuga ko gukaraba intoki hakoreshejwe amazi meza n’isabune ari imwe mu ngamba z’ingenzi zafasha abantu kwirinda indwara nyinshi ziterwa na mikorobe ndetse na virusi zimwe na zimwe.
Dore ahantu intoki z’umuntu zandurira cyane kurusha ahandi:
Umwanda munini (amabyi) waba uw’umuntu cyangwa uw’inyamanswa, kuko uba wuzuyemo mikorobi nyinshi nka Escherichia coli, salmonella, virusi zimwe na zimwe nka norovirusi itera kuruka n’impiswi.
Ubushakashatsi bwagaragaje ko ugereranyije, muri garama imwe (1g) y’umwanda munini hashobora kubonekamo amamiliyari ya zamikorobe.
Nanone kandi zishobora kujya ku ntoki mu gihe ukoze ku kintu ziriho, urugero nk’ahantu umuntu wanduye yakororeye cyangwa yitsamuriye.
Ahandi intoki zakwandurira zigakwirakwiza mikorobe ni ku bintu abantu bakunda gukoraho cyane nka telephone, mudasobwa, amafranga cyangwa ibikinisho by’abana, n’ibindi.
Izi mikorobe iyo utazikarabye ni zo zigenda zikwirakwizwa mu bandi bantu benshi, ari na ko zibatera indwara.
Bigenda gute ngo mikorobe zive ku ntoki zinjire mu mubiri w’umuntu?
Zishobora kunyura mu kwikora mu maso, mu zuru cyangwa se no ku munwa, zishobora kandi kwinjira mu mubiri zinyuze mu byo kurya no kunywa mu gihe umuntu arimo kubitegura cyangwa se arimo gufungura.
Tugaruke ku cyorezo cya Coronavirus cyagaragaye bwa mbere mu Bushinwa mu mpera z’umwaka ushize, kuri ubu kikaba kimaze kugera mu bihugu birenga 76 byo ku isi, no guhitana abakabakaba 3.000.
Mu ngamba zo kugikumira harimo no kugira isuku hibandwa ku gukaraba intoki.
Impamvu iyi ngamba iza mu zibanze ni uko Coronavirus yandura iyo umuntu yitsamuye cyangwa akoroye yegereye undi, iyo umuntu afite ibiganza byandujwe akaba yakora cyangwa yasuhuza umuntu ndetse no gukora ku kintu cyangwa ahantu hari iyo virusi.
Minisiteri y’Ubuzima mu Rwanda yemeza ko nubwo nta Coronavirus irahagaragara, abantu bakwiye kuyirinda binyuze mu ngamba zitandukanye zose zikubiye mu kugira isuku, iya mbere ikaba ari ugukaraba intoki buri gihe ukoresheje amazi meza n’isabune.
Ikigo cy’Igihugu cy’Iterambere (RDB), giherutse gutegeka abatanga serivisi zo gucumbikira abantu, harimo za resitora, utubari, utubyiniro, abatembereza ba mukerarugendo, ababayobora n’abategura ibikorwa bitandukanye, gushyiraho ahantu ho gukarabira intoki na alukolu (alcol) yagenewe gusukura intoki.
Ibi byashyizwe ku nyubako zose ndetse no mu modoka z’abakerarugendo cyangwa abashyitsi kugira ngo habungabungwe ubuzima n’umudendezo w’abashyitsi n’abakozi.
Icyakora nubwo ubukangurambaga bwo gukaraba intoki bwashyizwemo imbaraga mu Rwanda, bigaragara ko ibipimo bikiri hasi.
Inkuru ya Imvaho Nshya, mu kiganiro yagiranye na Mukamunana Alphonsine, umukozi muri Minisiteri y’Ubuzima ivuga ko biri kuri 5%.
Abanyarwanda bakaba bakwiye gukomeza kwirinda indwara zituruka ku mwanda, bubahiriza ibihe byo gukaraba intoki kandi bakoresheje amazi meza n’isabune.
Akomeza avuaga ko abantu bagombye kwita ku bihe by’ingenzi byo gukaraba intoki aribyo: igihe umuntu avuye ku musarani, agiye gutegura amafunguro, agiye kurya, agiye kugaburira umwana cyangwa kumwonsa, no kuzikaraba igihe cyose zanduye.
Umunyamakuru wa Kigali Today/KT Radio
@ naduw12

",https://www.kigalitoday.com/ubuzima/urusobe-rw-ubuzima/Gukaraba-intoki-uko-bikwiye-byakurinda-indwara-zirimo-na-Coronavirus,Health
Pasiteri yasabye imbabazi kubera ikwirakwizwa rya Coronavirus,"Uwo mupasiteri witwa Lee Man-hee uyoboye Itorero ryitwa Shincheonji Church of Jesus yapfukamye asaba imbabazi mu kiganiro yagiranye n’abanyamakuru.
Ibi yabitewe no kuba 60% by’abantu barenga 4000 banduye Coronavirus muri icyo gihugu ari abayoboke b’urwo rusengero, nk’uko iyi nkuru Kigali Today ikesha BBC ibivuga.
Koreya y’Epfo ni cyo gihugu kivugwamo Coronavirus cyane ku mubagane wa Aziya nyuma y’u Bushinwa. Kuri uyu wa mbere tariki 02 Werurwe 2020, icyo gihugu cyatangaje abandi bantu 476 bashya banduye, bituma umubare w’abanduye muri Koreya y’Epfo ugera kuri 4.212.
Abacamanza basabye ko uwo mupasiteri Lee Man-hee w’imyaka 88 y’amavuko akorwaho iperereza ku ruhare rukomeye yaba yaragize rwatumye iyo Virusi ikwirakwira hose.
Abayoboke b’urwo rusengero bivugwa ko ari bo bagaragayeho iyo Virusi bwa mbere, nyamara ubuyobozi bw’iryo torero burabihisha butinya ko bagirirwa nabi, bituma bajya mu materaniro hirya no hino biviramo abantu benshi kwandura.
Iryo torero ngo ryahishe amazina y’abakirisitu baryo bituma kubabona bigorana, icyakora kuri ubu ayo mazina ngo barayatanze nk’uko umuvugizi w’iryo torero Kim Shin-chang yabibwiye BBC.
Yagize ati ""Twari twatinye gutanga amazina yabo kubera ko twatinyaga ko byagira ingaruka ku mutekano wabo"".
Umuvugizi w’iryo torero yavuze ko impamvu babihishe ari uko n’ubusanzwe iryo torero rifatwa nk’iritavuga rumwe na gahunda za Leta, abayoboke baryo ngo bakaba bakunze guhura n’ihohoterwa kubera iyo mpamvu.
Umunyamakuru wa Kigali Today/KT Radio
@ h_malachie

",https://www.kigalitoday.com/ubuzima/indwara/Pasiteri-yasabye-imbabazi-kubera-ikwirakwizwa-rya-Coronavirus,Health
Coronavirus imaze kugera mu bihugu 70 (Urutonde),"Hagati mu kwezi k’Ukuboza k’umwaka ushize wa 2019 nibwo Umujyi wa Wuhan mu Bushinwa wagaragayemo indwara y’ibicurane iterwa n’agakoko(virus) katangiye kitwa 2019-nCoV nyuma kaza kwitwa Covid-19.
Mu mpera z’ukwezi kwa Mutarama 2020 Coronavirus yari imaze gufata ibice bitandukanye by’u Bushinwa ndetse imaze no kwambukira muri bimwe mu bihugu bituranye na bwo.
Ibi byatumye Ishami ry’Umuryango w’Abibumbye ryita ku buzima(OMS) ritangaza ko isi yose igomba gufatira ingamba zihuse indwara ya Coronavirus.
Kugeza mu gitondo cyo kuri uyu wa mbere tariki 02 Werurwe 2020 umubare w’abamaze guhitanwa n’iki cyorezo hirya no hino ku isi wari ugeze ku 3,069. Abamaze kwandura baragera kuri 89,779, naho abo byagaragaye ko bamaze gukira bakaba bari 45,501, guha nyuma hari bamwe basuzuma bagasanga ikibarimo.
Kuri ubu Coronavirus imaze kugera mu bihugu 70 byo hirya no hino ku isi, ariko ibimaze gupfusha abaturage benshi ni u Bushinwa bumaze kurenza abantu 2,954 bugakurikirwa na Korea y’Epfo yapfushije abarenga 30.
Coronavirus nta muti nta n’urukingo irabona, ariko hagati aho abaganga barifashisha imiti igabanya ubukana bwa SIDA ndetse n’ibinini bya Chloroquine bivura malaria, umurwayi yagira amahirwe agakira.
Kugeza mu gitondo cyo kuri uyu wa mbere tariki 02 Werurwe 2020, ibihugu byari bimaze kugaragaramo indwara ya Coronavirus ni u Bushinwa (80,026), Korea y’Epfo (4,335), Italy (1,704), Iran(1,501), Diamond Princess (705 ), Japan (256), Germany (150), France (130), Singapore (106), Hong Kong (100), Leta zunze Ubumwe za Amerika (88), Esipanye (86), Kuwait (56), Bahrain (47), Thailand (43), Taiwan (40), u Bwongereza (36), Australia (30), Malaysia (29), Canada (24), u Busuwisi (24), Iraq (21), U.A.E. (21), Norvege (19), Vietnam (16), Autriche (15), Sweden (14), Macao (10), Israel (10), Lebanon (10), u Buholandi (10), San Marino (8), Belgium (8), Croatia (8), Greece (7), Ecuador (6), Finland (6), Oman (6), u Buhinde (5), Mexico (5), Denmark (4), Pakistan (4), Philippines (3), Algeria (3), Azerbaijan (3), Czechia (3), Georgia (3), Iceland (3), Qatar (3), Romania (3), Brazil (2), Egypt (2), Indonesia (2), Portugal (2), u Burusiya (2).
Ibindi bihugu byari bimaze kubonekamo umuntu umwe wanduye Coronavirus. Ibyo ni Afghanistan, Andorra, Armenia, Belarus, Cambodia, Dominican Republic, Estonia, Lithuania, Luxembourg, North Macedonia, Monaco, Nepal, New Zealand, Nigeria, na Sri Lanka.
Umunyamakuru wa Kigali Today/KT Radio
@ SimonKamuzinzi

",https://www.kigalitoday.com/ubuzima/indwara/article/coronavirus-imaze-kugera-mu-bihugu-70-urutonde,Health
Leta n’abikorera bagiye kujya batanga amafaranga yo gufasha ubwisungane mu kwivuza,"

Iteka rigena inkunga y’ubwisungane mu kwivuza itangwa na Leta, itangwa n’ibigo bitanga ubwishingizi mu kwivuza mu Rwanda, itangwa n’ibigo bikoresha itumanaho ituruka ku guhamagara kuri telefone no ku icuruzwa ry’ibikomoka kuri peteroli n’uburyo iyo nkunga ishyikirizwa ubwisungane mu kwivuza.
Inkunga y’ubwisungane mu kwivuza itangwa na Leta harimo atangwa na Minisiteri y’Imari buri mwaka angana na miliyari esheshatu z’amafaranga y’u Rwanda “6.000.000.000 Frw” aturuka mu ngengo y’imari, hamwe n’ibihumbi bitatu by’amafaranga y’u Rwanda “3.000 Frw” buri mwaka kuri buri muntu utishoboye uri mu cyiciro cya mbere cy’Ubudehe.
Minisiteri y’Ubuzima izajya itanga 50% by’amafaranga yishyurwa ku iyandikwa ry’imiti n’ibikoresho byo mu buvuzi, inatange 100% by’amafaranga yishyurwa n’abakora ubushakashatsi mu rwego rw’ubuzima.
Minisiteri ifite ubucuruzi mu nshingano izajya itanga 10% by’amafaranga acibwa kuri serivisi zihabwa amasosiyete y’ubucuruzi akora ibikorwa by’imikino y’amahirwe.
Polisi y’u Rwanda izajya itanga 50% by’amafaranga yishyurwa mu kugenzura imiterere y’ibinyabiziga. Izajya inatanga 10% by’amafaranga acibwa abatwara ibinyabiziga bakoze amakosa mu muhanda.
Ikigo cya Leta gishinzwe ubuziranenge (RBS) kizajya gitanga 100% by’amafaranga acibwa abacuruza ibintu bitujuje ubuziranenge.
Umujyi wa Kigali uzajya utanga amafaranga 100 Frw ava ku mahoro yakwa kuri parikingi z’ibinyabiziga kuri buri saha imwe bihagaze.
Buri mukoresha azajya yishyura 0.5% y’umushahara umukozi atahana.
Urwego rushinzwe Iterambere mu Rwanda (RDB) ruzajya rutanga 10% by’amafaranga ava mu bukerarugendo agenewe uturere bireba.
Ikigo cy’imisoro n’amahoro kizajya gitanga amafaranga 20.000 Frw ava ku ihererekanya ry’imodoka na 10.000 Frw ava ku ihererekanya rya moto.
 Buri Karere kazajya gatanga 4.000 Frw kuri hegitari imwe y’ubutaka bw’igishanga, 5.000 Frw kuri hegitari imwe y’ubutaka bw’imusozi na 2.000 Frw kuri hegitari imwe y’amaterasi y’indinganire.
Iri teka rivuga ko uretse inkunga ya Leta igenewe abatishoboye itangwa bitarenze tariki ya 30 Nzeri buri mwaka, inkunga ya Leta ivugwa mu iteka ryerekeye inkunga z’ubwisungane mu kwivuza izajya itangwa buri gihembwe.
Inkunga ituruka muri buri kigo gitanga ubwishingizi bw’indwara gikorera mu Rwanda ni 5% y’imisanzu yose yinjijwe mu mwaka mu ishami ryacyo ry’ubwishingizi bw’indwara. Icyakora, inkunga itangwa n’Ikigo cya Leta gifite ishami ry’ubwishingizi bw’indwara mu nshingano zacyo ni 10% by’imisanzu yose yinjiye mu mwaka.
Inkunga itangwa na buri kigo gitanga ubwishingizi bw’indwara mu Rwanda igezwa mu kigo cya Leta gifite ubwisungane mu kwivuza mu nshingano zacyo mu minsi mirongo itatu “30” nyuma y’itariki umwaka w’ibaruramari ry’ikigo gitanga ubwishingizi bw’indwara warangiriyeho.
Buri sosiyete y’ubucuruzi bw’itumanaho yishyura inkunga y’ubwisungane mu kwivuza, aho mu mwaka wa mbere n’uwa kabiri uhereye igihe iri teka ritangarijweho mu Igazeti ya Leta ya Repubulika y’u Rwanda: amafaranga 2.5% y’agaciro k’ibyacurujwe byose ku mwaka n’isosiyete y’ubucuruzi; ku mwaka wa gatatu amafaranga aba 3% y’agaciro k’ibyacurujwe byose ku mwaka n’isosiyete y’ubucuruzi.
Buri sosiyete y’ubucuruzi bw’ibikomoka kuri peteroli yishyura inkunga mu bwisungane mu kwivuza ingana na 20 Frw kuri buri litiro y’ibikomoka kuri peteroli igurishije.
Buri sosiyete y’ubucuruzi bw’itumanaho cyangwa bw’ibikomoka kuri peteroli ishyikiriza Urwego rw’Igihugu rushinzwe kugenzura imikorere y’inzego zimwe z’imirimo ifitiye Igihugu akamaro inkunga yishyuye hakurikijwe uburyo bwagenwe n’urwo Rwego. Urwego rushyikiriza ubwisungane mu kwivuza inkunga yishyuwe bitarenze tariki ya 15 y’ukwezi gukurikira uko inkunga yishyuwemo.
Iri teka rigena ihazabu ku bigo bizajya bitubya inkunga iyo igenzura rigaragaje ko inkunga yishyuwe ari nke ku nkunga yagombaga kwishyurwa. Ikigo bireba cyishyura inkunga itarishyuwe kikanacibwa ihazabu yo mu rwego rw’ubutegetsi ya 200% by’iyo nkunga itarishyuwe.
Ihazabu yo mu rwego rw’ubutegetsi ivugwa mu gika cya mbere cy’iyi ngingo ishyirwa kuri konti y’ubwisungane mu kwivuza igacungwa hamwe n’amafaranga y’inkunga.
Umunyamakuru wa Kigali Today/KT Radio
@ sebuharara
",https://www.kigalitoday.com/ubuzima/ubuvuzi/article/leta-n-abikorera-bagiye-kujya-batanga-amafaranga-yo-gufasha-ubwisungane-mu-kwivuza,Health
Muri 2021 nta Munyarwanda urwaye Hépatite C uzaba adafata imiti (MINISANTE),"Yabitangaje kuri uyu wa Gatandatu tariki 29 Gashyantare 2020 ubwo hatangizwaga gahunda yo gusuzuma no kuvura indwara y’umwijima wo mu bwoko bwa C, igikorwa cyatangirijwe mu Karere ka Gatsibo, umurenge wa Kabarore.
Lt Col Dr. Mpunga Tharcisse avuga ko Abanyarwanda 4% bashobora kuba bafite indwara z’umwijima.
Avuga ko benshi bafite izi ndwara bazigendana batabizi kuko umuntu ashobora kuyimarana imyaka igera kuri 20 nta kimenyetso bari bibonaho.
Avuga ko Leta yihaye gahunda yo kurandura indwara y’umwijima wo mu bwoko bwa C ku buryo bizagera mu mwaka wa 2021 nta Munyarwanda ufite uyu mwijima uzaba atarabona imiti yo kuyivura.
Ati “Guverinoma y’u Rwanda ifite gahunda yo kurandura iyi ndwara mu Banyarwanda bose. Muri gahunda twihaye y’imyaka 2 yatangiye muri 2019, iteganya ko muri 2021 nta munyarwanda n’umwe ufite Virusi ya Hépatite C, waba utaragize amahirwe yo kubona imiti kandi akavurwa agakira.”
Minisitiri w’Ubutegetsi bw’Igihugu Prof. Shyaka Anastase, avuga ko kugira ngo kwisuzumisha no kuvura indwara y’umwijima wo mu bwoko bwa C bigere kuri benshi bisaba ubufatanye bw’inzego zose hakabaho no kwegereza abaturage iyi serivisi mu midugudu iwabo.
Asaba abayobozi mu nzego z’ibanze kugira iki gikorwa umuhigo bahereye mu isibo kugira ngo kigere kuri benshi kandi mu gihe gito.
Agira ati “Tubigire imihigo y’imirenge, akagari n’umudugudu, iyo mihigo ni iyihe, ni uguhiganwa kugira ngo turebe umudugudu, akagari n’umurenge uza kwesa umuhigo w’uko abaturage bawo bose baba bamaze kwisuzumisha.”
Igikorwa cyo gusuzuma no kuvura indwara y’umwijima wo mu bwoko bwa C cyateganyirijwe ingengo y’imari ya miliyoni 43 z’amadolari ya Amerika ariko ngo akaba ashobora kutazageraho bitewe n’uko hari abafatanyabikorwa biyemeje gufasha Leta muri iki gikorwa.
Gusuzuma no kuvura abagaragaweho umwijima wo mu bwoko bwa C bizajya bikorerwa ubuntu.
Kayisanabo Ernestine, umwe mu baturage bitabiriye ibi biganiro, avuga ko iki gikorwa kizitabirwa cyane kuko ubundi hari abatinyaga kwisuzumisha kuko n’ubundi basanze barwaye batabona ubushobozi bwo kugura imiti.
Ati “Hari abatinyaga kwisuzumisha kuko wasangaga bavuga ko n’ubundi basanze barwaye batabona ubushobozi bwo kugura imiti. Urumva rero bizitabirwa kuko bamenye ko imiti ari ubuntu.”
Umuyobozi w’Ikigo cy’Igihugu gishinzwe Ubuzima (RBC), Dr. Sabin Nsanzimana, avuga ko abantu miliyoni enye mu gihugu hose ari bo bagomba gusuzumwa, abagaragaweho uburwayi bw’umwijima wo mu bwoko bwa C bagahabwa imiti ku buntu.
Kuri ubu ngo abarenga miliyoni ebyiri ni bo bamaze kwisuzumisha.
Kuba iyi gahunda yatangirijwe mu Karere ka Gatsibo ngo ni uko aka karere ari ko kaza ku isonga ku rwego rw’igihugu mu kugira iyi ndwara kuko ku bantu 90,806 bisuzumishije 2,544 basanze barwaye.
Kuri ubu abantu ibihumbi 20 ni bo bafata imiti y’umwijima wo bwoko bwa C ariko ngo intego bakaba bagomba kugera ku bihumbi 110.
Intara y’Iburasirazuba n’iy’Amajyepfo ngo ni zo zigaragaramo abantu benshi bafite umwijima wo mu bwoko bwa C.
Umunyamakuru wa Kigali Today/KT Radio
@ SEBASAZAGEmman1
",https://www.kigalitoday.com/ubuzima/ubuvuzi/article/muri-2021-nta-munyarwanda-urwaye-hepatite-c-uzaba-adafata-imiti-minisante,Health
Algeria: Hagaragaye umurwayi wa mbere wa Coronavirus,"

Umurwayi wagaragaye muri Algeria nk’uko Kigali Today ibikesha BBC, ni Umutaliyani wageze muri icyo gihugu ku itariki 17 Gashyantare 2020.
Ibyo byatangajwe kuri televiziyo y’icyo gihugu, ubwo Minisitiri w’Ubuzima wa Algeria Abdel Rahman Ben Bouzid yemezaga ko uwo abaye umurwayi wa mbere ugaragaweho n’iyo virusi ya Coronavirus muri icyo gihugu.
Bikimara kwemezwa ko afite iyo virusi, yahise ashyirwa mu kato kugira ngo abanze yitabweho n’abaganga, bityo ntakomeze kwanduza abandi.
Amakuru dukesha BBC avuga ko Perezida wa Algeria yasabye abaturage kwitondera amakuru batangaza ku mbuga za internet ajyanye na Coronavirus.
Perezida Abdelmadjid Tebboune wa Algeria nyuma yaje gutangaza kuri Twitter ko yategetse abakuriye urwego rw’ubuvuzi mu gihugu kwigengesera ku rwego rwo hejuru rushoboka, nk’uko ibiro ntaramakuru by’Abongereza ‘Reuters’ bibitangaza.
Amajyaruguru y’u Butaliyani, atuwe n’Abanya-Algeria benshi, akomeje kuba izingiro rya Coronavirus muri icyo gihugu.
Kompanyi Eni y’iby’ingufu y’i Milan mu Butaliyani inafite imishinga muri Algeria.
Ibihugu byinshi by’i Burayi byatangaje abantu ba mbere basanzwemo Coronavirus, benshi bakaba bafitanye isano n’u Butaliyani aho ikomeje kwiyongera.
Austria (cyangwa Autriche), Croatia n’u Busuwisi byatangaje ko abantu basanzwemo Coronavirus bari baragiye mu Butaliyani.
Mu minsi mike ishize, u Butaliyani bwahindutse igihugu cyugarijwe na Coronavirus cyane i Burayi, mu Butaliyani hakaba hari abarwayi barenga 300, ikaba imaze guhitana abagera kuri 11.
Ariko n’ubwo bimeze bityo, ibihugu bituranye n’u Butaliyani byavuze ko gufunga imipaka yabyo ikora ku Butaliyani byaba birimo gukabya.
Coronavirus kandi yageze no muri Amerika y’Amajyepfo, mu gihugu cya Brazil.Uwo yagaragayeho ni umuturage ukomoka muri Brazil wari usubiye iwabo avuye mu Butaliyani.

",https://www.kigalitoday.com/ubuzima/indwara/Algeria-Hagaragaye-umurwayi-wa-mbere-wa-Coronavirus,Health
Yamaze imyaka ine arwaye umutima awukira mu byumweru bibiri,"Simpunga avuga ko agifatwa n’ubwo burwayi muri 2004 atari azi ibyo ari byo, ko yumvaga nta ntege, umutima ugatera cyane, yazamuka akantu gato bikanga akicara abandi bana bakamusiga ariko yahatiriza akitura hasi ubwenge bukagenda, yaruhuka gato akongera agahaguruka.
Yamaze iyo myaka ine abayeho muri ubwo buzima, gusa imiti yafataga yandikiwe na Dr Kagame Abel, umwe mu baganga mbarwa bavura umutima mu Rwanda, yamurindaga kuremba akomeza kwiga kugeza habonetse abaganga b’inzobere baramuvura.
Agira ati “Ndashimira abaganga b’Abanyarwanda, Dr Kagame na Prof Mucumbitsi bamfashije cyane kuko bahise bamenya uko uburwayi bwanjye buhagaze nyuma yo kuncisha mu cyuma. Bambwiye ko nagombaga kubagwa, wenda nkajya hanze cyangwa ngategereza abaganga b’inzobere b’Abanyamerika bendaga kuza mu Rwanda”.
Ati “Muri 2008 nibwo abo baganga baje, kimwe n’abandi twari dutegerezanyije baratubaga bigenda neza. Namaze ibyumweru bibiri mu bitaro mpita ntaha iwacu mu Bugesera numva mpumeka neza, ntangira gukora imirimo ntakoraga ndetse nkanazamuka singire ikibazo”.
Yongeraho ko kuva icyo gihe ubuzima bwe bwakomeje kugenda neza kuko yakomeje kwiga nubwo uwo mwaka yabazwemo yari yahagaritse ishuri, ubu akaba abasha gutwara igare akava i Kigali akajya i Bugesera akanagaruka ntagire ikibazo na kimwe.
Umutima wa Simpunga wari ufite ikibazo cy’uko mu turyango tune tunyuramo amaraso ajya mu byumba bine biwugize, tubiri muri two tutafungaga neza kuko akaryango gafunguka, amaraso agacamo kagahita kifunga kuko atemerewe kugaruka, ibyo ngo bigakira ari uko umutima ubazwe, ari byo yavuwe.
Yahisemo kuba umuganga ngo azajye avura abandi
Simpunga amaze kurangiza amashuri yisumbuye, yahisemo kwiga ikiganga muri kaminuza kugira ngo na we azajye afasha abababara abavure.
Ati “Iwacu duturiye ikigo nderabuzima, najyaga numva abataka cyangwa abana barira nkagira ikibazo. Nanjye igiti cyigeze kunjomba gihera mu mubiri, kwa muganga bantera ikinya bagikuramo ntababaye mpita nkunda ikiganga”.
Ati “Hiyongereyeho ko bamvuye umutima wari umereye nabi ndetse n’abandi barabavura dutaha mu minsi itarenze umunani, mpava niyemeje kwiga ikiganga ngo nanjye nzajye mfasha abandi”.
Simpunga ubu arangije kaminuza mu ishami ry’ubuganga (ushatse ukaba wamwita Dr Simpunga) akaba arimo kwimenyereza umwuga mu bitaro bya Kibagabaga byo mu Karere ka Gasabo, inzozi ze ngo zikaba ari uko azasubira kwiga kugira ngo azabe inzobere (Specialist) mu kuvura umutima, cyane ko mu Rwanda kugeza ubu bakiri mbarwa.
Agira inama abantu yo kwihutira kujya kwa muganga mu gihe babonye cyangwa bumvise ikintu kidasanzwe ku mubiri wabo kugira ngo bafashwe batarazahara.
Indwara y’umutima ibarirwa mu ndwara zitandura (NCDs) zikaba zihangayikishije u Rwanda n’isi muri rusange, kuko mu Rwanda zihitana 42% by’abantu bapfa mu mwaka naho ku isi indwara zitandura zishamikiye ku mutima zikica abantu miliyoni 17.7 buri mwaka.
Indwara enye ziza imbere mu kwica abantu benshi ni iz’umutima, iz’ubuhumekero, kanseri na diyabete, nyuma hakaza n’izindi nyinshi ariko impuguke mu kuzivura zikemeza ko 80% byazo zishobora kwirindwa, icy’ingenzi ngo ni ukugira umuco wo kwipimisha kugira ngo uwo basanganye imwe muri izo ndwara avurwe hakiri kare kuko nyinshi zikira.
Umunyamakuru wa Kigali Today/KT Radio
@ MunyantoreC
",https://www.kigalitoday.com/ubuzima/ubuvuzi/article/yamaze-imyaka-ine-arwaye-umutima-awukira-mu-byumweru-bibiri,Health
"Umurwayi n’ubwo yaba atazakira, yitabweho kandi ntahuhurwe – Papa Francis","Ubu ni bumwe mu butumwa abaganga bo ku bitaro bya Kaminuza bya Butare (CHUB) bagejejweho bizihizaga umunsi w’abarwayi ku cyumweru tariki 23 Gashyantare 2018.
Mu butumwa bwa Papa Fransisiko basomewe n’umupadiri mu gitambo cya misa cyabimburiye ibindi bikorwa byo kwisihiza umunsi w’abarwayi, hari ahagira hati “Mu gihe musuzuma, mukingira mutanga imiti, mukora ubushakashatsi bwita ku barwayi b’ingeri zose mugomba kumenya mbere na mbere ko mubikorera umuntu, aho kumurutisha uburwayi bwe.”
Ubu butumwa bunasaba abaganga kudahuhura abarwayi barwaye indwara zidakira ahubwo bakitabwaho by’umwihariko bakanoroherezwa ububabare.
Ubwo butumwa bugira buti “Twibuke ko ubuzima ari ndakorwaho. Ni ubw’Imana yonyine. Kirazira kubuvogera, ndetse nta n’ugomba kubugenga uko yishakiye. Igihe mudashoboye kuvura umurwayi ngo akire, mushobora gukomeza kumwitaho mumukorera ibimworohereza ububabare kandi bimuhumuriza.”
Ubu butumwa bwa Papa kandi bushishikariza ibigo bitanga serivisi z’ubuvuzi ndetse n’abayobozi b’ibihugu byose kwita ku byafasha n’abakene kwivuza aho kureba ubukungu gusa.
Umuyobozi wa CHUB, Dr. Augustin Sendegeya, avuga ko ubu butumwa bwabibukije ko bagomba kurushaho gutanga serivise nziza, ko n’ubwo basanzwe babyitaho, no kubyibukiranya ntacyo bitwaye.
Ati “Bajya bakoresha imvugo ngo ijambo ryiza ni mugenzi w’Imana. Buriya n’iy’umuntu arwaye atazakira, ntugomba kubimuhisha mubiganiraho, ariko ukanamwitaho, ukamenya ububabare afite ukanagira uruhare mu kubugabanya.”
N’ubwo CHUB yizihije umunsi mpuzamahanga w’abarwayi tariki 23 Gashyantare 2020, ubundi wizihizwa ku rwego rw’isi buri mwaka tariki 11 Gashyantare. Kuwizihiza byashyizweho na Mutagatifu Papa Yohani Pawulo wa II mu mwaka wa 1992.
Umunyamakuru wa Kigali Today/KT Radio
@ JoyeuseC
",https://www.kigalitoday.com/ubuzima/ubuvuzi/article/umurwayi-n-ubwo-yaba-atazakira-yitabweho-kandi-ntahuhurwe-papa-francis,Health
